Unnamed: 0,Category,SubCategory,FullyQualifiedName,MethodName,Description
209,Series,Datetimelike Properties,pandas.Series.dt.week,week,The week ordinal of the year
210,Series,Datetimelike Properties,pandas.Series.dt.weekofyear,weekofyear,The week ordinal of the year
211,Series,Datetimelike Properties,pandas.Series.dt.dayofweek,dayofweek,"The day of the week with Monday=0, Sunday=6"
212,Series,Datetimelike Properties,pandas.Series.dt.weekday,weekday,"The day of the week with Monday=0, Sunday=6"
213,Series,Datetimelike Properties,pandas.Series.dt.weekday_name,weekday_name,The name of day in a week (ex: Friday)
214,Series,Datetimelike Properties,pandas.Series.dt.dayofyear,dayofyear,The ordinal day of the year
215,Series,Datetimelike Properties,pandas.Series.dt.quarter,quarter,The quarter of the date
216,Series,Datetimelike Properties,pandas.Series.dt.is_month_start,is_month_start,Logical indicating if first day of month (defined by frequency)
217,Series,Datetimelike Properties,pandas.Series.dt.is_month_end,is_month_end,Logical indicating if last day of month (defined by frequency)
218,Series,Datetimelike Properties,pandas.Series.dt.is_quarter_start,is_quarter_start,Logical indicating if first day of quarter (defined by frequency)
219,Series,Datetimelike Properties,pandas.Series.dt.is_quarter_end,is_quarter_end,Logical indicating if last day of quarter (defined by frequency)
220,Series,Datetimelike Properties,pandas.Series.dt.is_year_start,is_year_start,Logical indicating if first day of year (defined by frequency)
221,Series,Datetimelike Properties,pandas.Series.dt.is_year_end,is_year_end,Logical indicating if last day of year (defined by frequency)
222,Series,Datetimelike Properties,pandas.Series.dt.is_leap_year,is_leap_year,Logical indicating if the date belongs to a leap year
223,Series,Datetimelike Properties,pandas.Series.dt.daysinmonth,daysinmonth,The number of days in the month
224,Series,Datetimelike Properties,pandas.Series.dt.days_in_month,days_in_month,The number of days in the month
225,Series,Datetimelike Properties,pandas.Series.dt.tz,tz,
226,Series,Datetimelike Properties,pandas.Series.dt.freq,freq,
227,Series,String handling,pandas.Series.str.capitalize,capitalize,Convert strings in the Series/Index to be capitalized.
228,Series,String handling,pandas.Series.str.cat,cat,Concatenate strings in the Series/Index with given separator.
229,Series,String handling,pandas.Series.str.center,center,Filling left and right side of strings in the Series/Index with an additional character.
230,Series,String handling,pandas.Series.str.contains,contains,Return boolean Series/array whether given pattern/regex is contained in each string in the Series/Index.
231,Series,String handling,pandas.Series.str.count,count,Count occurrences of pattern in each string of the Series/Index.
232,Series,String handling,pandas.Series.str.decode,decode,Decode character string in the Series/Index using indicated encoding.
233,Series,String handling,pandas.Series.str.encode,encode,Encode character string in the Series/Index using indicated encoding.
234,Series,String handling,pandas.Series.str.endswith,endswith,Return boolean Series indicating whether each string in the Series/Index ends with passed pattern.
235,Series,String handling,pandas.Series.str.extract,extract,"For each subject string in the Series, extract groups from the first match of regular expression pat."
236,Series,String handling,pandas.Series.str.extractall,extractall,"For each subject string in the Series, extract groups from all matches of regular expression pat."
237,Series,String handling,pandas.Series.str.find,find,Return lowest indexes in each strings in the Series/Index where the substring is fully contained between [start:end].
238,Series,String handling,pandas.Series.str.findall,findall,Find all occurrences of pattern or regular expression in the Series/Index.
239,Series,String handling,pandas.Series.str.get,get,"Extract element from lists, tuples, or strings in each element in the Series/Index."
240,Series,String handling,pandas.Series.str.index,index,Return lowest indexes in each strings where the substring is fully contained between [start:end].
241,Series,String handling,pandas.Series.str.join,join,Join lists contained as elements in the Series/Index with passed delimiter.
242,Series,String handling,pandas.Series.str.len,len,Compute length of each string in the Series/Index.
243,Series,String handling,pandas.Series.str.ljust,ljust,Filling right side of strings in the Series/Index with an additional character.
244,Series,String handling,pandas.Series.str.lower,lower,Convert strings in the Series/Index to lowercase.
245,Series,String handling,pandas.Series.str.lstrip,lstrip,Strip whitespace (including newlines) from each string in the Series/Index from left side.
246,Series,String handling,pandas.Series.str.match,match,Determine if each string matches a regular expression.
247,Series,String handling,pandas.Series.str.normalize,normalize,Return the Unicode normal form for the strings in the Series/Index.
248,Series,String handling,pandas.Series.str.pad,pad,Pad strings in the Series/Index with an additional character to specified side.
249,Series,String handling,pandas.Series.str.partition,partition,"Split the string at the first occurrence of sep, and return 3 elements containing the part before the separator, the separator itself, and the part after the separator."
250,Series,String handling,pandas.Series.str.repeat,repeat,Duplicate each string in the Series/Index by indicated number of times.
251,Series,String handling,pandas.Series.str.replace,replace,Replace occurrences of pattern/regex in the Series/Index with some other string.
252,Series,String handling,pandas.Series.str.rfind,rfind,Return highest indexes in each strings in the Series/Index where the substring is fully contained between [start:end].
253,Series,String handling,pandas.Series.str.rindex,rindex,Return highest indexes in each strings where the substring is fully contained between [start:end].
254,Series,String handling,pandas.Series.str.rjust,rjust,Filling left side of strings in the Series/Index with an additional character.
255,Series,String handling,pandas.Series.str.rpartition,rpartition,"Split the string at the last occurrence of sep, and return 3 elements containing the part before the separator, the separator itself, and the part after the separator."
256,Series,String handling,pandas.Series.str.rstrip,rstrip,Strip whitespace (including newlines) from each string in the Series/Index from right side.
257,Series,String handling,pandas.Series.str.slice,slice,Slice substrings from each element in the Series/Index
258,Series,String handling,pandas.Series.str.slice_replace,slice_replace,Replace a slice of each string in the Series/Index with another string.
259,Series,String handling,pandas.Series.str.split,split,"Split each string (a la re.split) in the Series/Index by given pattern, propagating NA values."
260,Series,String handling,pandas.Series.str.rsplit,rsplit,"Split each string in the Series/Index by the given delimiter string, starting at the end of the string and working to the front."
261,Series,String handling,pandas.Series.str.startswith,startswith,Return boolean Series/array indicating whether each string in the Series/Index starts with passed pattern.
262,Series,String handling,pandas.Series.str.strip,strip,Strip whitespace (including newlines) from each string in the Series/Index from left and right sides.
263,Series,String handling,pandas.Series.str.swapcase,swapcase,Convert strings in the Series/Index to be swapcased.
264,Series,String handling,pandas.Series.str.title,title,Convert strings in the Series/Index to titlecase.
265,Series,String handling,pandas.Series.str.translate,translate,Map all characters in the string through the given mapping table.
266,Series,String handling,pandas.Series.str.upper,upper,Convert strings in the Series/Index to uppercase.
267,Series,String handling,pandas.Series.str.wrap,wrap,Wrap long strings in the Series/Index to be formatted in paragraphs with length less than a given width.
268,Series,String handling,pandas.Series.str.zfill,zfill,Filling left side of strings in the Series/Index with 0.
269,Series,String handling,pandas.Series.str.isalnum,isalnum,Check whether all characters in each string in the Series/Index are alphanumeric.
270,Series,String handling,pandas.Series.str.isalpha,isalpha,Check whether all characters in each string in the Series/Index are alphabetic.
271,Series,String handling,pandas.Series.str.isdigit,isdigit,Check whether all characters in each string in the Series/Index are digits.
272,Series,String handling,pandas.Series.str.isspace,isspace,Check whether all characters in each string in the Series/Index are whitespace.
273,Series,String handling,pandas.Series.str.islower,islower,Check whether all characters in each string in the Series/Index are lowercase.
274,Series,String handling,pandas.Series.str.isupper,isupper,Check whether all characters in each string in the Series/Index are uppercase.
275,Series,String handling,pandas.Series.str.istitle,istitle,Check whether all characters in each string in the Series/Index are titlecase.
276,Series,String handling,pandas.Series.str.isnumeric,isnumeric,Check whether all characters in each string in the Series/Index are numeric.
277,Series,String handling,pandas.Series.str.isdecimal,isdecimal,Check whether all characters in each string in the Series/Index are decimal.
278,Series,String handling,pandas.Series.str.get_dummies,get_dummies,Split each string in the Series by sep and return a frame of dummy/indicator variables.
279,Series,Categorical,pandas.api.types.CategoricalDtype,CategoricalDtype,Type for categorical data with the categories and orderedness
280,Series,Plotting,pandas.Series.plot,plot,Series plotting accessor and method
281,Series,Serialization / IO / Conversion,pandas.Series.from_csv,from_csv,"Read CSV file (DEPRECATED, please use pandas.read_csv() instead)."
282,Series,Serialization / IO / Conversion,pandas.Series.to_pickle,to_pickle,Pickle (serialize) object to input file path.
283,Series,Serialization / IO / Conversion,pandas.Series.to_csv,to_csv,Write Series to a comma-separated values (csv) file
284,Series,Serialization / IO / Conversion,pandas.Series.to_dict,to_dict,Convert Series to {label -> value} dict or dict-like object.
285,Series,Serialization / IO / Conversion,pandas.Series.to_excel,to_excel,Write Series to an excel sheet
286,Series,Serialization / IO / Conversion,pandas.Series.to_frame,to_frame,Convert Series to DataFrame
287,Series,Serialization / IO / Conversion,pandas.Series.to_xarray,to_xarray,Return an xarray object from the pandas object.
288,Series,Serialization / IO / Conversion,pandas.Series.to_hdf,to_hdf,Write the contained data to an HDF5 file using HDFStore.
289,Series,Serialization / IO / Conversion,pandas.Series.to_sql,to_sql,Write records stored in a DataFrame to a SQL database.
290,Series,Serialization / IO / Conversion,pandas.Series.to_msgpack,to_msgpack,msgpack (serialize) object to input file path
291,Series,Serialization / IO / Conversion,pandas.Series.to_json,to_json,Convert the object to a JSON string.
292,Series,Serialization / IO / Conversion,pandas.Series.to_sparse,to_sparse,Convert Series to SparseSeries
293,Series,Serialization / IO / Conversion,pandas.Series.to_dense,to_dense,Return dense representation of NDFrame (as opposed to sparse)
294,Series,Serialization / IO / Conversion,pandas.Series.to_string,to_string,Render a string representation of the Series
295,Series,Serialization / IO / Conversion,pandas.Series.to_clipboard,to_clipboard,"Attempt to write text representation of object to the system clipboard This can be pasted into Excel, for example."
296,Series,Serialization / IO / Conversion,pandas.Series.to_latex,to_latex,Render an object to a tabular environment table.
297,Series,Sparse,pandas.SparseSeries.to_coo,to_coo,Create a scipy.sparse.coo_matrix from a SparseSeries with MultiIndex.
298,Series,Sparse,pandas.SparseSeries.from_coo,from_coo,Create a SparseSeries from a scipy.sparse.coo_matrix.
299,DataFrame,Constructor,pandas.DataFrame,DataFrame,"Two-dimensional size-mutable, potentially heterogeneous tabular data structure with labeled axes (rows and columns)."
300,DataFrame,Attributes and underlying data,pandas.DataFrame.as_matrix,as_matrix,Convert the frame to its Numpy-array representation.
301,DataFrame,Attributes and underlying data,pandas.DataFrame.dtypes,dtypes,Return the dtypes in this object.
302,DataFrame,Attributes and underlying data,pandas.DataFrame.ftypes,ftypes,Return the ftypes (indication of sparse/dense and dtype) in this object.
303,DataFrame,Attributes and underlying data,pandas.DataFrame.get_dtype_counts,get_dtype_counts,Return the counts of dtypes in this object.
304,DataFrame,Attributes and underlying data,pandas.DataFrame.get_ftype_counts,get_ftype_counts,Return the counts of ftypes in this object.
305,DataFrame,Attributes and underlying data,pandas.DataFrame.select_dtypes,select_dtypes,Return a subset of a DataFrame including/excluding columns based on their dtype.
306,DataFrame,Attributes and underlying data,pandas.DataFrame.values,values,Numpy representation of NDFrame
307,DataFrame,Attributes and underlying data,pandas.DataFrame.axes,axes,Return a list with the row axis labels and column axis labels as the only members.
308,DataFrame,Attributes and underlying data,pandas.DataFrame.ndim,ndim,Number of axes / array dimensions
309,DataFrame,Attributes and underlying data,pandas.DataFrame.size,size,number of elements in the NDFrame
310,DataFrame,Attributes and underlying data,pandas.DataFrame.shape,shape,Return a tuple representing the dimensionality of the DataFrame.
311,DataFrame,Attributes and underlying data,pandas.DataFrame.memory_usage,memory_usage,Memory usage of DataFrame columns.
312,DataFrame,Conversion,pandas.DataFrame.astype,astype,Cast a pandas object to a specified dtype dtype.
313,DataFrame,Conversion,pandas.DataFrame.convert_objects,convert_objects,Deprecated.
314,DataFrame,Conversion,pandas.DataFrame.infer_objects,infer_objects,Attempt to infer better dtypes for object columns.
315,DataFrame,Conversion,pandas.DataFrame.copy,copy,Make a copy of this objects data.
316,DataFrame,Conversion,pandas.DataFrame.isna,isna,Return a boolean same-sized object indicating if the values are NA.
317,DataFrame,Conversion,pandas.DataFrame.notna,notna,Return a boolean same-sized object indicating if the values are not NA.
318,DataFrame,"Indexing, iteration",pandas.DataFrame.head,head,Return the first n rows.
319,DataFrame,"Indexing, iteration",pandas.DataFrame.at,at,Fast label-based scalar accessor
320,DataFrame,"Indexing, iteration",pandas.DataFrame.iat,iat,Fast integer location scalar accessor.
321,DataFrame,"Indexing, iteration",pandas.DataFrame.loc,loc,Purely label-location based indexer for selection by label.
322,DataFrame,"Indexing, iteration",pandas.DataFrame.iloc,iloc,Purely integer-location based indexing for selection by position.
323,DataFrame,"Indexing, iteration",pandas.DataFrame.insert,insert,Insert column into DataFrame at specified location.
324,DataFrame,"Indexing, iteration",pandas.DataFrame.__iter__,__iter__,Iterate over infor axis
325,DataFrame,"Indexing, iteration",pandas.DataFrame.iteritems,iteritems,"Iterator over (column name, Series) pairs."
326,DataFrame,"Indexing, iteration",pandas.DataFrame.iterrows,iterrows,"Iterate over DataFrame rows as (index, Series) pairs."
327,DataFrame,"Indexing, iteration",pandas.DataFrame.itertuples,itertuples,"Iterate over DataFrame rows as namedtuples, with index value as first element of the tuple."
328,DataFrame,"Indexing, iteration",pandas.DataFrame.lookup,lookup,Label-based fancy indexing function for DataFrame.
329,DataFrame,"Indexing, iteration",pandas.DataFrame.pop,pop,Return item and drop from frame.
330,DataFrame,"Indexing, iteration",pandas.DataFrame.tail,tail,Return the last n rows.
331,DataFrame,"Indexing, iteration",pandas.DataFrame.xs,xs,Returns a cross-section (row(s) or column(s)) from the Series/DataFrame.
332,DataFrame,"Indexing, iteration",pandas.DataFrame.isin,isin,Return boolean DataFrame showing whether each element in the DataFrame is contained in values.
333,DataFrame,"Indexing, iteration",pandas.DataFrame.where,where,Return an object of same shape as self and whose corresponding entries are from self where cond is True and otherwise are from other.
334,DataFrame,"Indexing, iteration",pandas.DataFrame.mask,mask,Return an object of same shape as self and whose corresponding entries are from self where cond is False and otherwise are from other.
335,DataFrame,"Indexing, iteration",pandas.DataFrame.query,query,Query the columns of a frame with a boolean expression.
336,DataFrame,Binary operator functions,pandas.DataFrame.add,add,"Addition of dataframe and other, element-wise (binary operator add)."
337,DataFrame,Binary operator functions,pandas.DataFrame.sub,sub,"Subtraction of dataframe and other, element-wise (binary operator sub)."
338,DataFrame,Binary operator functions,pandas.DataFrame.mul,mul,"Multiplication of dataframe and other, element-wise (binary operator mul)."
339,DataFrame,Binary operator functions,pandas.DataFrame.div,div,"Floating division of dataframe and other, element-wise (binary operator truediv)."
340,DataFrame,Binary operator functions,pandas.DataFrame.truediv,truediv,"Floating division of dataframe and other, element-wise (binary operator truediv)."
341,DataFrame,Binary operator functions,pandas.DataFrame.floordiv,floordiv,"Integer division of dataframe and other, element-wise (binary operator floordiv)."
342,DataFrame,Binary operator functions,pandas.DataFrame.mod,mod,"Modulo of dataframe and other, element-wise (binary operator mod)."
343,DataFrame,Binary operator functions,pandas.DataFrame.pow,pow,"Exponential power of dataframe and other, element-wise (binary operator pow)."
344,DataFrame,Binary operator functions,pandas.DataFrame.radd,radd,"Addition of dataframe and other, element-wise (binary operator radd)."
345,DataFrame,Binary operator functions,pandas.DataFrame.rsub,rsub,"Subtraction of dataframe and other, element-wise (binary operator rsub)."
346,DataFrame,Binary operator functions,pandas.DataFrame.rmul,rmul,"Multiplication of dataframe and other, element-wise (binary operator rmul)."
347,DataFrame,Binary operator functions,pandas.DataFrame.rdiv,rdiv,"Floating division of dataframe and other, element-wise (binary operator rtruediv)."
348,DataFrame,Binary operator functions,pandas.DataFrame.rtruediv,rtruediv,"Floating division of dataframe and other, element-wise (binary operator rtruediv)."
349,DataFrame,Binary operator functions,pandas.DataFrame.rfloordiv,rfloordiv,"Integer division of dataframe and other, element-wise (binary operator rfloordiv)."
350,DataFrame,Binary operator functions,pandas.DataFrame.rmod,rmod,"Modulo of dataframe and other, element-wise (binary operator rmod)."
351,DataFrame,Binary operator functions,pandas.DataFrame.rpow,rpow,"Exponential power of dataframe and other, element-wise (binary operator rpow)."
352,DataFrame,Binary operator functions,pandas.DataFrame.lt,lt,Wrapper for flexible comparison methods lt
353,DataFrame,Binary operator functions,pandas.DataFrame.gt,gt,Wrapper for flexible comparison methods gt
354,DataFrame,Binary operator functions,pandas.DataFrame.le,le,Wrapper for flexible comparison methods le
355,DataFrame,Binary operator functions,pandas.DataFrame.ge,ge,Wrapper for flexible comparison methods ge
356,DataFrame,Binary operator functions,pandas.DataFrame.ne,ne,Wrapper for flexible comparison methods ne
357,DataFrame,Binary operator functions,pandas.DataFrame.eq,eq,Wrapper for flexible comparison methods eq
358,DataFrame,Binary operator functions,pandas.DataFrame.combine,combine,"Add two DataFrame objects and do not propagate NaN values, so if for a"
359,DataFrame,Binary operator functions,pandas.DataFrame.combine_first,combine_first,Combine two DataFrame objects and default to non-null values in frame calling the method.
360,DataFrame,"Function application, GroupBy & Window",pandas.DataFrame.apply,apply,Applies function along input axis of DataFrame.
361,DataFrame,"Function application, GroupBy & Window",pandas.DataFrame.applymap,applymap,"Apply a function to a DataFrame that is intended to operate elementwise, i.e."
362,DataFrame,"Function application, GroupBy & Window",pandas.DataFrame.aggregate,aggregate,"Aggregate using callable, string, dict, or list of string/callables"
363,DataFrame,"Function application, GroupBy & Window",pandas.DataFrame.transform,transform,Call function producing a like-indexed NDFrame
364,DataFrame,"Function application, GroupBy & Window",pandas.DataFrame.groupby,groupby,"Group series using mapper (dict or key function, apply given 
function to group, return result as series) or by a series of columns."
365,DataFrame,"Function application, GroupBy & Window",pandas.DataFrame.rolling,rolling,Provides rolling window calculations.
366,DataFrame,"Function application, GroupBy & Window",pandas.DataFrame.expanding,expanding,Provides expanding transformations.
367,DataFrame,"Function application, GroupBy & Window",pandas.DataFrame.ewm,ewm,Provides exponential weighted functions
368,DataFrame,Computations / Descriptive Stats,pandas.DataFrame.abs,abs,Return an object with absolute value takenonly applicable to objects that are all numeric.
369,DataFrame,Computations / Descriptive Stats,pandas.DataFrame.all,all,Return whether all elements are True over requested axis
370,DataFrame,Computations / Descriptive Stats,pandas.DataFrame.any,any,Return whether any element is True over requested axis
371,DataFrame,Computations / Descriptive Stats,pandas.DataFrame.clip,clip,Trim values at input threshold(s).
372,DataFrame,Computations / Descriptive Stats,pandas.DataFrame.clip_lower,clip_lower,Return copy of the input with values below given value(s) truncated.
373,DataFrame,Computations / Descriptive Stats,pandas.DataFrame.clip_upper,clip_upper,Return copy of input with values above given value(s) truncated.
374,DataFrame,Computations / Descriptive Stats,pandas.DataFrame.corr,corr,"Compute pairwise correlation of columns, excluding NA/null values"
375,DataFrame,Computations / Descriptive Stats,pandas.DataFrame.corrwith,corrwith,Compute pairwise correlation between rows or columns of two DataFrame objects.
376,DataFrame,Computations / Descriptive Stats,pandas.DataFrame.count,count,Return Series with number of non-NA/null observations over requested axis.
377,DataFrame,Computations / Descriptive Stats,pandas.DataFrame.cov,cov,"Compute pairwise covariance of columns, excluding NA/null values"
378,DataFrame,Computations / Descriptive Stats,pandas.DataFrame.cummax,cummax,Return cumulative max over requested axis.
379,DataFrame,Computations / Descriptive Stats,pandas.DataFrame.cummin,cummin,Return cumulative minimum over requested axis.
380,DataFrame,Computations / Descriptive Stats,pandas.DataFrame.cumprod,cumprod,Return cumulative product over requested axis.
381,DataFrame,Computations / Descriptive Stats,pandas.DataFrame.cumsum,cumsum,Return cumulative sum over requested axis.
382,DataFrame,Computations / Descriptive Stats,pandas.DataFrame.describe,describe,"Generates descriptive statistics that summarize the central 
tendency, dispersion and shape of a datasets distribution, excluding NaN values."
383,DataFrame,Computations / Descriptive Stats,pandas.DataFrame.diff,diff,1st discrete difference of object
384,DataFrame,Computations / Descriptive Stats,pandas.DataFrame.eval,eval,Evaluate an expression in the context of the calling DataFrame instance.
385,DataFrame,Computations / Descriptive Stats,pandas.DataFrame.kurt,kurt,Return unbiased kurtosis over requested axis using Fishers definition of kurtosis (kurtosis of normal == 0.0).
386,DataFrame,Computations / Descriptive Stats,pandas.DataFrame.mad,mad,Return the mean absolute deviation of the values for the requested axis
387,DataFrame,Computations / Descriptive Stats,pandas.DataFrame.max,max,This method returns the maximum of the values in the object.
388,DataFrame,Computations / Descriptive Stats,pandas.DataFrame.mean,mean,Return the mean of the values for the requested axis
389,DataFrame,Computations / Descriptive Stats,pandas.DataFrame.median,median,Return the median of the values for the requested axis
390,DataFrame,Computations / Descriptive Stats,pandas.DataFrame.min,min,This method returns the minimum of the values in the object.
391,DataFrame,Computations / Descriptive Stats,pandas.DataFrame.mode,mode,Gets the mode(s) of each element along the axis selected.
392,DataFrame,Computations / Descriptive Stats,pandas.DataFrame.pct_change,pct_change,Percent change over given number of periods.
393,DataFrame,Computations / Descriptive Stats,pandas.DataFrame.prod,prod,Return the product of the values for the requested axis
394,DataFrame,Computations / Descriptive Stats,pandas.DataFrame.quantile,quantile,"Return values at the given quantile over requested axis, a la numpy.percentile."
395,DataFrame,Computations / Descriptive Stats,pandas.DataFrame.rank,rank,Compute numerical data ranks (1 through n) along axis.
396,DataFrame,Computations / Descriptive Stats,pandas.DataFrame.round,round,Round a DataFrame to a variable number of decimal places.
397,DataFrame,Computations / Descriptive Stats,pandas.DataFrame.sem,sem,Return unbiased standard error of the mean over requested axis.
398,DataFrame,Computations / Descriptive Stats,pandas.DataFrame.skew,skew,Return unbiased skew over requested axis
399,DataFrame,Computations / Descriptive Stats,pandas.DataFrame.sum,sum,Return the sum of the values for the requested axis
400,DataFrame,Computations / Descriptive Stats,pandas.DataFrame.std,std,Return sample standard deviation over requested axis.
401,DataFrame,Computations / Descriptive Stats,pandas.DataFrame.var,var,Return unbiased variance over requested axis.
