Unnamed: 0,Category,SubCategory,FullyQualifiedName,MethodName,Description
402,DataFrame,Reindexing / Selection / Label manipulation,pandas.DataFrame.add_prefix,add_prefix,Concatenate prefix string with panel items names.
403,DataFrame,Reindexing / Selection / Label manipulation,pandas.DataFrame.add_suffix,add_suffix,Concatenate suffix string with panel items names.
404,DataFrame,Reindexing / Selection / Label manipulation,pandas.DataFrame.align,align,Align two objects on their axes with the
405,DataFrame,Reindexing / Selection / Label manipulation,pandas.DataFrame.drop,drop,Return new object with labels in requested axis removed.
406,DataFrame,Reindexing / Selection / Label manipulation,pandas.DataFrame.drop_duplicates,drop_duplicates,"Return DataFrame with duplicate rows removed, optionally only"
407,DataFrame,Reindexing / Selection / Label manipulation,pandas.DataFrame.duplicated,duplicated,"Return boolean Series denoting duplicate rows, optionally only"
408,DataFrame,Reindexing / Selection / Label manipulation,pandas.DataFrame.equals,equals,Determines if two NDFrame objects contain the same elements.
409,DataFrame,Reindexing / Selection / Label manipulation,pandas.DataFrame.filter,filter,Subset rows or columns of dataframe according to labels in the specified index.
410,DataFrame,Reindexing / Selection / Label manipulation,pandas.DataFrame.first,first,Convenience method for subsetting initial periods of time series data based on a date offset.
411,DataFrame,Reindexing / Selection / Label manipulation,pandas.DataFrame.head,head,Return the first n rows.
412,DataFrame,Reindexing / Selection / Label manipulation,pandas.DataFrame.idxmax,idxmax,Return index of first occurrence of maximum over requested axis.
413,DataFrame,Reindexing / Selection / Label manipulation,pandas.DataFrame.idxmin,idxmin,Return index of first occurrence of minimum over requested axis.
414,DataFrame,Reindexing / Selection / Label manipulation,pandas.DataFrame.last,last,Convenience method for subsetting final periods of time series data based on a date offset.
415,DataFrame,Reindexing / Selection / Label manipulation,pandas.DataFrame.reindex,reindex,"Conform DataFrame to new index with optional filling logic, placing NA/NaN in locations having no value in the previous index."
416,DataFrame,Reindexing / Selection / Label manipulation,pandas.DataFrame.reindex_axis,reindex_axis,"Conform input object to new index with optional filling logic, 
placing NA/NaN in locations having no value in the previous index."
417,DataFrame,Reindexing / Selection / Label manipulation,pandas.DataFrame.reindex_like,reindex_like,Return an object with matching indices to myself.
418,DataFrame,Reindexing / Selection / Label manipulation,pandas.DataFrame.rename,rename,Alter axes labels.
419,DataFrame,Reindexing / Selection / Label manipulation,pandas.DataFrame.rename_axis,rename_axis,Alter the name of the index or columns.
420,DataFrame,Reindexing / Selection / Label manipulation,pandas.DataFrame.reset_index,reset_index,"For DataFrame with multi-level index, return new DataFrame with 
labeling information in the columns under the index names, defaulting to
 level_0, level_1, etc."
421,DataFrame,Reindexing / Selection / Label manipulation,pandas.DataFrame.sample,sample,Returns a random sample of items from an axis of object.
422,DataFrame,Reindexing / Selection / Label manipulation,pandas.DataFrame.select,select,Return data corresponding to axis labels matching criteria
423,DataFrame,Reindexing / Selection / Label manipulation,pandas.DataFrame.set_index,set_index,Set the DataFrame index (row labels) using one or more existing columns.
424,DataFrame,Reindexing / Selection / Label manipulation,pandas.DataFrame.tail,tail,Return the last n rows.
425,DataFrame,Reindexing / Selection / Label manipulation,pandas.DataFrame.take,take,Return the elements in the given positional indices along an axis.
426,DataFrame,Reindexing / Selection / Label manipulation,pandas.DataFrame.truncate,truncate,Truncates a sorted DataFrame/Series before and/or after some particular index value.
427,DataFrame,Missing data handling,pandas.DataFrame.dropna,dropna,Return object with labels on given axis omitted where alternately any
428,DataFrame,Missing data handling,pandas.DataFrame.fillna,fillna,Fill NA/NaN values using the specified method
429,DataFrame,Missing data handling,pandas.DataFrame.replace,replace,Replace values given in to_replace with value.
430,DataFrame,"Reshaping, sorting, transposing",pandas.DataFrame.pivot,pivot,Reshape data (produce a pivot table) based on column values.
431,DataFrame,"Reshaping, sorting, transposing",pandas.DataFrame.reorder_levels,reorder_levels,Rearrange index levels using input order.
432,DataFrame,"Reshaping, sorting, transposing",pandas.DataFrame.sort_values,sort_values,Sort by the values along either axis
433,DataFrame,"Reshaping, sorting, transposing",pandas.DataFrame.sort_index,sort_index,Sort object by labels (along an axis)
434,DataFrame,"Reshaping, sorting, transposing",pandas.DataFrame.nlargest,nlargest,Get the rows of a DataFrame sorted by the n largest values of columns.
435,DataFrame,"Reshaping, sorting, transposing",pandas.DataFrame.nsmallest,nsmallest,Get the rows of a DataFrame sorted by the n smallest values of columns.
436,DataFrame,"Reshaping, sorting, transposing",pandas.DataFrame.swaplevel,swaplevel,Swap levels i and j in a MultiIndex on a particular axis
437,DataFrame,"Reshaping, sorting, transposing",pandas.DataFrame.stack,stack,"Pivot a level of the (possibly hierarchical) column labels, 
returning a DataFrame (or Series in the case of an object with a single 
level of column labels) having a hierarchical index with a new 
inner-most level of row labels."
438,DataFrame,"Reshaping, sorting, transposing",pandas.DataFrame.unstack,unstack,"Pivot a level of the (necessarily hierarchical) index labels, 
returning a DataFrame having a new level of column labels whose 
inner-most level consists of the pivoted index labels."
439,DataFrame,"Reshaping, sorting, transposing",pandas.DataFrame.melt,melt,"Unpivots a DataFrame from wide format to long format, optionally"
440,DataFrame,"Reshaping, sorting, transposing",pandas.DataFrame.T,T,Transpose index and columns
441,DataFrame,"Reshaping, sorting, transposing",pandas.DataFrame.to_panel,to_panel,"Transform long (stacked) format (DataFrame) into wide (3D, Panel) format."
442,DataFrame,"Reshaping, sorting, transposing",pandas.DataFrame.to_xarray,to_xarray,Return an xarray object from the pandas object.
443,DataFrame,"Reshaping, sorting, transposing",pandas.DataFrame.transpose,transpose,Transpose index and columns
444,DataFrame,Combining / joining / merging,pandas.DataFrame.append,append,"Append rows of other to the end of this frame, returning a new object."
445,DataFrame,Combining / joining / merging,pandas.DataFrame.assign,assign,"Assign new columns to a DataFrame, returning a new object (a copy) with all the original columns in addition to the new ones."
446,DataFrame,Combining / joining / merging,pandas.DataFrame.join,join,Join columns with other DataFrame either on index or on a key column.
447,DataFrame,Combining / joining / merging,pandas.DataFrame.merge,merge,Merge DataFrame objects by performing a database-style join operation by columns or indexes.
448,DataFrame,Combining / joining / merging,pandas.DataFrame.update,update,Modify DataFrame in place using non-NA values from passed DataFrame.
449,DataFrame,Time series-related,pandas.DataFrame.asfreq,asfreq,Convert TimeSeries to specified frequency.
450,DataFrame,Time series-related,pandas.DataFrame.asof,asof,The last row without any NaN is taken (or the last row without
451,DataFrame,Time series-related,pandas.DataFrame.shift,shift,Shift index by desired number of periods with an optional time freq
452,DataFrame,Time series-related,pandas.DataFrame.first_valid_index,first_valid_index,Return index for first non-NA/null value.
453,DataFrame,Time series-related,pandas.DataFrame.last_valid_index,last_valid_index,Return index for last non-NA/null value.
454,DataFrame,Time series-related,pandas.DataFrame.resample,resample,Convenience method for frequency conversion and resampling of time series.
455,DataFrame,Time series-related,pandas.DataFrame.to_period,to_period,Convert DataFrame from DatetimeIndex to PeriodIndex with desired
456,DataFrame,Time series-related,pandas.DataFrame.to_timestamp,to_timestamp,"Cast to DatetimeIndex of timestamps, at beginning of period"
457,DataFrame,Time series-related,pandas.DataFrame.tz_convert,tz_convert,Convert tz-aware axis to target time zone.
458,DataFrame,Time series-related,pandas.DataFrame.tz_localize,tz_localize,Localize tz-naive TimeSeries to target time zone.
459,DataFrame,Plotting,pandas.DataFrame.plot,plot,DataFrame plotting accessor and method
460,DataFrame,Serialization / IO / Conversion,pandas.DataFrame.from_csv,from_csv,"Read CSV file (DEPRECATED, please use pandas.read_csv() instead)."
461,DataFrame,Serialization / IO / Conversion,pandas.DataFrame.from_dict,from_dict,Construct DataFrame from dict of array-like or dicts
462,DataFrame,Serialization / IO / Conversion,pandas.DataFrame.from_items,from_items,"Convert (key, value) pairs to DataFrame."
463,DataFrame,Serialization / IO / Conversion,pandas.DataFrame.from_records,from_records,Convert structured or record ndarray to DataFrame
464,DataFrame,Serialization / IO / Conversion,pandas.DataFrame.info,info,Concise summary of a DataFrame.
465,DataFrame,Serialization / IO / Conversion,pandas.DataFrame.to_pickle,to_pickle,Pickle (serialize) object to input file path.
466,DataFrame,Serialization / IO / Conversion,pandas.DataFrame.to_csv,to_csv,Write DataFrame to a comma-separated values (csv) file
467,DataFrame,Serialization / IO / Conversion,pandas.DataFrame.to_hdf,to_hdf,Write the contained data to an HDF5 file using HDFStore.
468,DataFrame,Serialization / IO / Conversion,pandas.DataFrame.to_sql,to_sql,Write records stored in a DataFrame to a SQL database.
469,DataFrame,Serialization / IO / Conversion,pandas.DataFrame.to_dict,to_dict,Convert DataFrame to dictionary.
470,DataFrame,Serialization / IO / Conversion,pandas.DataFrame.to_excel,to_excel,Write DataFrame to an excel sheet
471,DataFrame,Serialization / IO / Conversion,pandas.DataFrame.to_json,to_json,Convert the object to a JSON string.
472,DataFrame,Serialization / IO / Conversion,pandas.DataFrame.to_html,to_html,Render a DataFrame as an HTML table.
473,DataFrame,Serialization / IO / Conversion,pandas.DataFrame.to_feather,to_feather,write out the binary feather-format for DataFrames
474,DataFrame,Serialization / IO / Conversion,pandas.DataFrame.to_latex,to_latex,Render an object to a tabular environment table.
475,DataFrame,Serialization / IO / Conversion,pandas.DataFrame.to_stata,to_stata,A class for writing Stata binary dta files from array-like objects
476,DataFrame,Serialization / IO / Conversion,pandas.DataFrame.to_msgpack,to_msgpack,msgpack (serialize) object to input file path
477,DataFrame,Serialization / IO / Conversion,pandas.DataFrame.to_gbq,to_gbq,Write a DataFrame to a Google BigQuery table.
478,DataFrame,Serialization / IO / Conversion,pandas.DataFrame.to_records,to_records,Convert DataFrame to record array.
479,DataFrame,Serialization / IO / Conversion,pandas.DataFrame.to_sparse,to_sparse,Convert to SparseDataFrame
480,DataFrame,Serialization / IO / Conversion,pandas.DataFrame.to_dense,to_dense,Return dense representation of NDFrame (as opposed to sparse)
481,DataFrame,Serialization / IO / Conversion,pandas.DataFrame.to_string,to_string,Render a DataFrame to a console-friendly tabular output.
482,DataFrame,Serialization / IO / Conversion,pandas.DataFrame.to_clipboard,to_clipboard,"Attempt to write text representation of object to the system clipboard This can be pasted into Excel, for example."
483,DataFrame,Sparse,pandas.SparseDataFrame.to_coo,to_coo,Return the contents of the frame as a sparse SciPy COO matrix.
484,Panel,Constructor,pandas.Panel,Panel,"Represents wide format panel data, stored as 3-dimensional array"
485,Panel,Attributes and underlying data,pandas.Panel.values,values,Numpy representation of NDFrame
486,Panel,Attributes and underlying data,pandas.Panel.axes,axes,Return index label(s) of the internal NDFrame
487,Panel,Attributes and underlying data,pandas.Panel.ndim,ndim,Number of axes / array dimensions
488,Panel,Attributes and underlying data,pandas.Panel.size,size,number of elements in the NDFrame
489,Panel,Attributes and underlying data,pandas.Panel.shape,shape,Return a tuple of axis dimensions
490,Panel,Attributes and underlying data,pandas.Panel.dtypes,dtypes,Return the dtypes in this object.
491,Panel,Attributes and underlying data,pandas.Panel.ftypes,ftypes,Return the ftypes (indication of sparse/dense and dtype) in this object.
492,Panel,Attributes and underlying data,pandas.Panel.get_dtype_counts,get_dtype_counts,Return the counts of dtypes in this object.
493,Panel,Attributes and underlying data,pandas.Panel.get_ftype_counts,get_ftype_counts,Return the counts of ftypes in this object.
494,Panel,Conversion,pandas.Panel.astype,astype,Cast a pandas object to a specified dtype dtype.
495,Panel,Conversion,pandas.Panel.copy,copy,Make a copy of this objects data.
496,Panel,Conversion,pandas.Panel.isna,isna,Return a boolean same-sized object indicating if the values are NA.
497,Panel,Conversion,pandas.Panel.notna,notna,Return a boolean same-sized object indicating if the values are not NA.
498,Panel,Getting and setting,pandas.Panel.get_value,get_value,"Quickly retrieve single value at (item, major, minor) location"
499,Panel,Getting and setting,pandas.Panel.set_value,set_value,"Quickly set single value at (item, major, minor) location"
500,Panel,"Indexing, iteration, slicing",pandas.Panel.at,at,Fast label-based scalar accessor
501,Panel,"Indexing, iteration, slicing",pandas.Panel.iat,iat,Fast integer location scalar accessor.
502,Panel,"Indexing, iteration, slicing",pandas.Panel.loc,loc,Purely label-location based indexer for selection by label.
503,Panel,"Indexing, iteration, slicing",pandas.Panel.iloc,iloc,Purely integer-location based indexing for selection by position.
504,Panel,"Indexing, iteration, slicing",pandas.Panel.__iter__,__iter__,Iterate over infor axis
505,Panel,"Indexing, iteration, slicing",pandas.Panel.iteritems,iteritems,"Iterate over (label, values) on info axis"
506,Panel,"Indexing, iteration, slicing",pandas.Panel.pop,pop,Return item and drop from frame.
507,Panel,"Indexing, iteration, slicing",pandas.Panel.xs,xs,Return slice of panel along selected axis
508,Panel,"Indexing, iteration, slicing",pandas.Panel.major_xs,major_xs,Return slice of panel along major axis
509,Panel,"Indexing, iteration, slicing",pandas.Panel.minor_xs,minor_xs,Return slice of panel along minor axis
510,Panel,Binary operator functions,pandas.Panel.add,add,"Addition of series and other, element-wise (binary operator add)."
511,Panel,Binary operator functions,pandas.Panel.sub,sub,"Subtraction of series and other, element-wise (binary operator sub)."
512,Panel,Binary operator functions,pandas.Panel.mul,mul,"Multiplication of series and other, element-wise (binary operator mul)."
513,Panel,Binary operator functions,pandas.Panel.div,div,"Floating division of series and other, element-wise (binary operator truediv)."
514,Panel,Binary operator functions,pandas.Panel.truediv,truediv,"Floating division of series and other, element-wise (binary operator truediv)."
515,Panel,Binary operator functions,pandas.Panel.floordiv,floordiv,"Integer division of series and other, element-wise (binary operator floordiv)."
516,Panel,Binary operator functions,pandas.Panel.mod,mod,"Modulo of series and other, element-wise (binary operator mod)."
517,Panel,Binary operator functions,pandas.Panel.pow,pow,"Exponential power of series and other, element-wise (binary operator pow)."
518,Panel,Binary operator functions,pandas.Panel.radd,radd,"Addition of series and other, element-wise (binary operator radd)."
519,Panel,Binary operator functions,pandas.Panel.rsub,rsub,"Subtraction of series and other, element-wise (binary operator rsub)."
520,Panel,Binary operator functions,pandas.Panel.rmul,rmul,"Multiplication of series and other, element-wise (binary operator rmul)."
521,Panel,Binary operator functions,pandas.Panel.rdiv,rdiv,"Floating division of series and other, element-wise (binary operator rtruediv)."
522,Panel,Binary operator functions,pandas.Panel.rtruediv,rtruediv,"Floating division of series and other, element-wise (binary operator rtruediv)."
523,Panel,Binary operator functions,pandas.Panel.rfloordiv,rfloordiv,"Integer division of series and other, element-wise (binary operator rfloordiv)."
524,Panel,Binary operator functions,pandas.Panel.rmod,rmod,"Modulo of series and other, element-wise (binary operator rmod)."
525,Panel,Binary operator functions,pandas.Panel.rpow,rpow,"Exponential power of series and other, element-wise (binary operator rpow)."
526,Panel,Binary operator functions,pandas.Panel.lt,lt,Wrapper for comparison method lt
527,Panel,Binary operator functions,pandas.Panel.gt,gt,Wrapper for comparison method gt
528,Panel,Binary operator functions,pandas.Panel.le,le,Wrapper for comparison method le
529,Panel,Binary operator functions,pandas.Panel.ge,ge,Wrapper for comparison method ge
530,Panel,Binary operator functions,pandas.Panel.ne,ne,Wrapper for comparison method ne
531,Panel,Binary operator functions,pandas.Panel.eq,eq,Wrapper for comparison method eq
532,Panel,"Function application, GroupBy",pandas.Panel.apply,apply,Applies function along axis (or axes) of the Panel
533,Panel,"Function application, GroupBy",pandas.Panel.groupby,groupby,"Group data on given axis, returning GroupBy object"
534,Panel,Computations / Descriptive Stats,pandas.Panel.abs,abs,Return an object with absolute value takenonly applicable to objects that are all numeric.
535,Panel,Computations / Descriptive Stats,pandas.Panel.clip,clip,Trim values at input threshold(s).
536,Panel,Computations / Descriptive Stats,pandas.Panel.clip_lower,clip_lower,Return copy of the input with values below given value(s) truncated.
537,Panel,Computations / Descriptive Stats,pandas.Panel.clip_upper,clip_upper,Return copy of input with values above given value(s) truncated.
538,Panel,Computations / Descriptive Stats,pandas.Panel.count,count,Return number of observations over requested axis.
539,Panel,Computations / Descriptive Stats,pandas.Panel.cummax,cummax,Return cumulative max over requested axis.
540,Panel,Computations / Descriptive Stats,pandas.Panel.cummin,cummin,Return cumulative minimum over requested axis.
541,Panel,Computations / Descriptive Stats,pandas.Panel.cumprod,cumprod,Return cumulative product over requested axis.
542,Panel,Computations / Descriptive Stats,pandas.Panel.cumsum,cumsum,Return cumulative sum over requested axis.
543,Panel,Computations / Descriptive Stats,pandas.Panel.max,max,This method returns the maximum of the values in the object.
544,Panel,Computations / Descriptive Stats,pandas.Panel.mean,mean,Return the mean of the values for the requested axis
545,Panel,Computations / Descriptive Stats,pandas.Panel.median,median,Return the median of the values for the requested axis
546,Panel,Computations / Descriptive Stats,pandas.Panel.min,min,This method returns the minimum of the values in the object.
547,Panel,Computations / Descriptive Stats,pandas.Panel.pct_change,pct_change,Percent change over given number of periods.
548,Panel,Computations / Descriptive Stats,pandas.Panel.prod,prod,Return the product of the values for the requested axis
549,Panel,Computations / Descriptive Stats,pandas.Panel.sem,sem,Return unbiased standard error of the mean over requested axis.
550,Panel,Computations / Descriptive Stats,pandas.Panel.skew,skew,Return unbiased skew over requested axis
551,Panel,Computations / Descriptive Stats,pandas.Panel.sum,sum,Return the sum of the values for the requested axis
552,Panel,Computations / Descriptive Stats,pandas.Panel.std,std,Return sample standard deviation over requested axis.
553,Panel,Computations / Descriptive Stats,pandas.Panel.var,var,Return unbiased variance over requested axis.
554,Panel,Reindexing / Selection / Label manipulation,pandas.Panel.add_prefix,add_prefix,Concatenate prefix string with panel items names.
555,Panel,Reindexing / Selection / Label manipulation,pandas.Panel.add_suffix,add_suffix,Concatenate suffix string with panel items names.
556,Panel,Reindexing / Selection / Label manipulation,pandas.Panel.drop,drop,Return new object with labels in requested axis removed.
557,Panel,Reindexing / Selection / Label manipulation,pandas.Panel.equals,equals,Determines if two NDFrame objects contain the same elements.
558,Panel,Reindexing / Selection / Label manipulation,pandas.Panel.filter,filter,Subset rows or columns of dataframe according to labels in the specified index.
559,Panel,Reindexing / Selection / Label manipulation,pandas.Panel.first,first,Convenience method for subsetting initial periods of time series data based on a date offset.
560,Panel,Reindexing / Selection / Label manipulation,pandas.Panel.last,last,Convenience method for subsetting final periods of time series data based on a date offset.
561,Panel,Reindexing / Selection / Label manipulation,pandas.Panel.reindex,reindex,"Conform Panel to new index with optional filling logic, placing NA/NaN in locations having no value in the previous index."
562,Panel,Reindexing / Selection / Label manipulation,pandas.Panel.reindex_axis,reindex_axis,"Conform input object to new index with optional filling logic, 
placing NA/NaN in locations having no value in the previous index."
563,Panel,Reindexing / Selection / Label manipulation,pandas.Panel.reindex_like,reindex_like,Return an object with matching indices to myself.
564,Panel,Reindexing / Selection / Label manipulation,pandas.Panel.rename,rename,Alter axes input function or functions.
565,Panel,Reindexing / Selection / Label manipulation,pandas.Panel.sample,sample,Returns a random sample of items from an axis of object.
566,Panel,Reindexing / Selection / Label manipulation,pandas.Panel.select,select,Return data corresponding to axis labels matching criteria
567,Panel,Reindexing / Selection / Label manipulation,pandas.Panel.take,take,Return the elements in the given positional indices along an axis.
568,Panel,Reindexing / Selection / Label manipulation,pandas.Panel.truncate,truncate,Truncates a sorted DataFrame/Series before and/or after some particular index value.
569,Panel,Missing data handling,pandas.Panel.dropna,dropna,"Drop 2D from panel, holding passed axis constant"
570,Panel,Missing data handling,pandas.Panel.fillna,fillna,Fill NA/NaN values using the specified method
571,Panel,"Reshaping, sorting, transposing",pandas.Panel.sort_index,sort_index,Sort object by labels (along an axis)
572,Panel,"Reshaping, sorting, transposing",pandas.Panel.swaplevel,swaplevel,Swap levels i and j in a MultiIndex on a particular axis
573,Panel,"Reshaping, sorting, transposing",pandas.Panel.transpose,transpose,Permute the dimensions of the Panel
574,Panel,"Reshaping, sorting, transposing",pandas.Panel.swapaxes,swapaxes,Interchange axes and swap values axes appropriately
575,Panel,"Reshaping, sorting, transposing",pandas.Panel.conform,conform,Conform input DataFrame to align with chosen axis pair.
576,Panel,Combining / joining / merging,pandas.Panel.join,join,Join items with other Panel either on major and minor axes column
577,Panel,Combining / joining / merging,pandas.Panel.update,update,"Modify Panel in place using non-NA values from passed Panel, or object coercible to Panel."
578,Panel,Time series-related,pandas.Panel.asfreq,asfreq,Convert TimeSeries to specified frequency.
579,Panel,Time series-related,pandas.Panel.shift,shift,Shift index by desired number of periods with an optional time freq.
580,Panel,Time series-related,pandas.Panel.resample,resample,Convenience method for frequency conversion and resampling of time series.
581,Panel,Time series-related,pandas.Panel.tz_convert,tz_convert,Convert tz-aware axis to target time zone.
582,Panel,Time series-related,pandas.Panel.tz_localize,tz_localize,Localize tz-naive TimeSeries to target time zone.
583,Panel,Serialization / IO / Conversion,pandas.Panel.from_dict,from_dict,Construct Panel from dict of DataFrame objects
584,Panel,Serialization / IO / Conversion,pandas.Panel.to_pickle,to_pickle,Pickle (serialize) object to input file path.
585,Panel,Serialization / IO / Conversion,pandas.Panel.to_excel,to_excel,Write each DataFrame in Panel to a separate excel sheet
586,Panel,Serialization / IO / Conversion,pandas.Panel.to_hdf,to_hdf,Write the contained data to an HDF5 file using HDFStore.
587,Panel,Serialization / IO / Conversion,pandas.Panel.to_sparse,to_sparse,"NOT IMPLEMENTED: do not call this method, as sparsifying is not supported for Panel objects and will raise an error."
588,Panel,Serialization / IO / Conversion,pandas.Panel.to_frame,to_frame,"Transform wide format into long (stacked) format as DataFrame whose 
columns are the Panels items and whose index is a MultiIndex formed of 
the Panels major and minor axes."
589,Panel,Serialization / IO / Conversion,pandas.Panel.to_xarray,to_xarray,Return an xarray object from the pandas object.
590,Panel,Serialization / IO / Conversion,pandas.Panel.to_clipboard,to_clipboard,"Attempt to write text representation of object to the system clipboard This can be pasted into Excel, for example."
591,Index,Attributes,pandas.Index.values,values,return the underlying data as an ndarray
592,Index,Attributes,pandas.Index.is_monotonic,is_monotonic,alias for is_monotonic_increasing (deprecated)
593,Index,Attributes,pandas.Index.is_monotonic_increasing,is_monotonic_increasing,return if the index is monotonic increasing (only equal or
